{
  "case_id": "p3",
  "case_metadata": {
    "fields": {
      "OS": "[REDACTED_OS]",
      "Paciente": "PACIENTE_P3",
      "Exame": "RMABSHEP",
      "Data": "20/01/2026"
    },
    "raw_markdown": "- **OS:** [REDACTED_OS]\n- **Paciente:** PACIENTE_P3\n- **Exame:** RMABSHEP\n- **Data:** 20/01/2026"
  },
  "clinical_context": {
    "raw_markdown": "Resumo Clínico Estruturado\n\nPaciente: PACIENTE_P3\nID/Prontuário: [REDACTED_ID]\nIdade/Sexo: 37 anos, Masculino\nConvênio: [REDACTED_CONVENIO]\nTipo de exame: RM Abdome Superior com Contraste Hepatoespecífico\nData/Hora: [REDACTED_DATETIME]\nLocal/Serviço: [REDACTED_LOCAL]\nMédico: [REDACTED_MEDICO]\n\n1. RESUMO EXECUTIVO\n• Avaliação de múltiplos nódulos hepáticos com discrepância diagnóstica entre USG (normal), TC (hemangioma) e RM prévia (abscesso).\n\n2. PERGUNTA CLÍNICA\n• Dúvida principal: Diferenciação etiológica de nódulos hepáticos (Hemangioma vs Abscesso vs Necrose).\n• Indicação literal: COM CONTRASTE HEPATESPECIFICO - MELHOR CARACTERIZAÇÃO DE NODULOS HEPATICOS.\n• Sintoma principal + tempo: Avaliação de nódulo hepático; tratamento para H. Pylori há 1 semana.\n\n3. HISTÓRIA DA DOENÇA ATUAL\n• Início/evolução/intensidade: Achados incidentais em exames de imagem com laudos divergentes\n• Sinais/sintomas-chave: Assintomático para febre, vômitos ou perda ponderal.\n• Hipóteses consideradas: Hemangioma, Abscesso hepático, Lesões necróticas.\n\n4. CIRURGIA E PROCEDIMENTOS PRÉVIOS\n• Nega cirurgias prévios no abdome ou pelve.\n\n5. ANTECEDENTES E COMORBIDADES\n• Oncologia: Nega histórico pessoal de câncer.\n• Doenças crônicas relevantes: Histórico de patologia no fígado não especificada.\n• Infecções recentes: Infecção por H. Pylori relatada há 1 semana.\n\n6. MEDICAÇÕES E CONDIÇÕES QUE MUDAM CONDUTA\n• Antibioticoterapia/tratamento para H. Pylori em curso.\n\n7. ALERGIA E SEGURANÇA\n• Alergia a contraste iodado: Nega.\n• RM: Portador de implantes dentários e tatuagens.\n• Função renal: Nega insuficiência renal.\n• Gestação: Não aplicável.\n\n8. LABORATÓRIO RELEVANTE\n• Não constam resultados laboratoriais nos documentos analisados.\n\n9. EXAMES PRÉVIOS E COMPARATIVOS\n• Exames anteriores: USG (12/12) normal; TC sugerindo hemangiomas; RM anterior sugerindo abscessos.\n• Achados prévios-chave: Lesão no Segmento VI (3,8 x 2,3 cm), Segmento II (2,2 x 1,6 cm) e nódulos nos Segmentos IVA/IVB (1,0 cm) com restrição à difusão.\n\n10. STATUS OPERACIONAL\n• Contraste: Primovist (10ml IV) administrado em 20/01/2026.\n• Pré-medicações: Buscopan simples (1 ampola).\n• Peso/IMC: [DIVERGENTE] 85kg e 87kg registrados; Altura: 1,72m.\n• Intercorrências: Nenhuma intercorrência durante o exame.\n\n11. TEXTO DO PEDIDO (LEGÍVEL)\n• Ressonância nuclear magnética de abdome superior COM CONTRASTE HEPATESPECIFICO. TUSS: 41101170. INDICAÇÃO? MELHOR CARACTERIZAÇÃO DE NODULOS HEPATICOS. PACIENTE COM VARIOS EXAMES DE IMAGEM COM LAUDOS DIFERENTES. USG DE ABDOME DE 12/12 NORMAL; TC MOSTRANDO NODULOS SUGESTIVOS DE HEMANGIOMA; RNM MOSTRANDO NODULOS SUGESTIVOS DE ABCESSO. RNM DE ABDOME; LESOES HEPATICAS DE ETIOLOGIA INDETERMINADA A ESCLARECER. A POSSIBILIDADE DE LESOES LIQUEFEITAS / NECROTICAS OU ATE MESMO ABSCESSOS DEVEM SER CONSIDERADOS NO DIGNOSTICO DIFERENCIAL. LESOES DE 3,8X2,3 CM EM SEGUIMENTO VI, E SEGMENTO II DE 2,2X1,6 CM. HA OUTRAS DUAS FORMAÇOES NODULARES MENORES NO SEGMENTO IVA E IV B, COM APARENTE RESTRIÇAO A DIFUSAO MEDINDO 1CM, INDETERMINADAS."
  },
  "dictation_raw": "[00:00] [barulho] múltiplas lesões hepáticas, tá?\n[00:09] Essas lesões elas exibem...\n[00:14] ...um leve hipersinal em T2, tá?\n[00:28] Levemente hiperintenso, na verdade hiperintenso em T2, com halo periférico espesso bem definido de maior hipointensidade, mas ainda hiperintenso em relação ao parênquima...\n[00:42] ...e uma área central bem delimitada ainda de maior hiperintensidade, tá? Normalmente são ovaladas, estão esparsas, tá?\n[00:51] ...exceto por duas que exibem aspecto mais confluente ali e possivelmente estão agrupadas ali, tá?\n[01:00] Na região ali da projeção do segmento hepático...\n[01:15] ...do segmento hepático seis, né?\n[01:24] Essas lesões, tá? Elas têm um marcado hipersinal em T2 na porção central, né? Nas sequências em...\n[01:37] ...não exibem presença de gordura, tá? São hipointensas em T1, tá?\n[01:47] Com a porção central mais hipointensa em T1, tá? Sem componente gorduroso...\n[01:59] [barulho]\n[02:12] Sem aparentes focos de hemorragia bem definido, tá?\n[02:23] As duas lesões ali possivelmente confluente ali no segmento hepático seis, elas exibem um mínimo aparente alteração perfusional adjacente com leve...\n[02:38] ...un aparente edema também com hipersinal em T2 bem discreto periférico, tá? Muito discreto, até difícil. Avaliação de algumas fases pós-contraste foi limitado um pouco por conta dos artefatos, tá?\n[02:51] Em relação às sequências em difusão, tá?\n[03:02] [barulho]\n[03:14] A gente nota nas sequências com elevado valor de B, né? Que aparentemente todas essas lesões, tá?\n[03:23] Elas exibem uma porção periférica, tá? Uma restrição de difusão em halo aí, tá?\n[03:37] Com hipersinal marcado aí na no em B elevado, tá? E um ADC, tá? Na porção periférica por vezes estimado em até 1,4 vezes 10 a menos 3, tá?\n[03:52] Com maior hipossinal lá na porção periférica, por vezes até 1,3 vezes 10 a menos 3. E a porção central aparentemente não restringe, tem um efeito de T2 shine-through, tá?\n[04:06] Mostrando um elevado hipersinal no ADC com até 2,3 vezes 10 a menos 3, tá?\n[04:20] Aí, a fase arterial ela ficou um pouco mais difícil a avaliação, né?\n[04:33] Mas a gente nota o seguinte, tá? Preciso que faça o cálculo do wash-in e eventual wash-out pra gente ter melhor certeza, tá? Das alterações...\n[04:47] [barulho]\n[05:00] A fase então arterial ficou bem prejudicada, tá? Mas são medidas aqui, tá?\n[05:13] Primeiramente eu vou medir a porção periférica dessas lesão quanto a a possibilidade aí de realce, tá?\n[05:26] [barulho]\n[05:40] [barulho]\n[05:52] Então aí foi no sem contraste aí, né? 226 na porção periférica do halo, tá? Sem contraste. Na fase...\n[06:04] ...arterial é bem limitado, tá? Mas exibindo determinadas regiões aí com até, por exemplo, 382.\n[06:18] Aí no fase portal, tá? Medindo essas determinadas regiões aí mais na periferia com até 417, tá?\n[06:28] E na fase de equilíbrio, tá? Com até 384.\n[06:43] Na verdade, somente corrigindo, na fase portal, tá? Com 393, tá?\n[06:54] Aí na fase hepatobiliar, tá? Medindo...\n[07:08] [barulho]\n[07:21] ...essas regiões aí por exemplo cerca de 384, tá? Com 10 minutos. Com 15 minutos, tá?\n[07:34] Medindo aí cerca de 344, né? E com cerca aí de 20 minutos, tá?\n[07:47] Regiões aí medindo até 341, tá? Agora em relação a porção central, tá?\n[08:00] Na sem contraste aí mediu 160, tá? Na...\n[08:09] ...fase arterial cerca de 181. Na...\n[08:22] ...portal aí cerca de 152, tá? Na equilíbrio 160.\n[08:34] Aí na hepatobiliar aí com 10 minutos, tá? 186.\n[08:47] Tá? Com cerca de 15 minutos, tá? 220 e com cerca aí de 20 minutos, tá? 207.\n[09:00] Enquanto isso o realce do parênquima adjacente aí normal, tá? É de cerca de 296 no sem contraste, tá? No arterial...\n[09:13] ...355. No portal 473, tá? No equilíbrio 495. No hepatobiliar com 10 minutos 574. No hepatobiliar com 15 minutos 602 e no hepatobiliar com...\n[09:26] ...20 minutos 585, tá? Faça todos os cálculos de wash-in, wash-out pra gente ver melhor, tá? Estas alterações aí, tá?\n[09:40] O realce aparentemente aí na porção central esboça por vezes, não sei se realça ou não, mas tem um aspecto heterogêneo no pós-contraste, tá? A porção periférica forma um halo bem definido aí...\n[09:55] ...com um como se fosse com dois halos, na verdade com uma cápsula mais espessa onde foi feito essas medidas aí, tá?\n[10:08] Não vejo um o realce é mais evidente na fase arterial que tem um leve hiper alteração de realce da porção mais periférica daquelas duas lesões ali no e algumas lesões periféricas, tá?\n[10:22] Aí esse hiper-realce transitório, mas a avaliação é limitado por conta dos artefatos, tá? Não vejo sinais de cirrose, não vejo evidência de esteatose significativa, tá? As dimensões...\n[10:36] ...hepáticas aparentemente normal, tá? Não vejo sinais de dimensões aumentadas hepáticas com o fígado aí medindo no maior eixo longitudinal à direita 9,5, tá? À esquerda, tá? com até...\n[10:49] ...6,4. O as veias hepáticas ok. Veia porta também...\n[11:02] ...sem alterações relevantes, pérveas, tá? Eu não vejo as lesões aí, tá? Aquelas duas maiores na projeção ali do segmento hepático seis, tá?\n[11:13] Elas formam uma única agrupada, que mede na sua maior extensão cerca de 4,4 centímetros, sendo elas duas compostas aí por duas lesões aparentemente...\n[11:27] ...agrupadas que medem cada uma 2,5 centímetros e 2,3 centímetros aproximadamente, tá? É visualizada uma lesão ali na na porção periférica do segmento hepático dois, tá?\n[11:41] Medindo aquela lesão na porção periférica ali cerca de...\n[11:55] ...2,2 centímetros, tá? Basicamente todas as lesões têm um comportamento parecido, tá? Uma outra...\n[12:08] ...essas então são as maiores lesões aí descritas, tá? Observa-se ainda uma na porção periférica do segmento hepático sete, tá? E que mede aí cerca de 1,9 centímetros, todas as outras medindo menos, tá?\n[12:21] Não vejo linfonodomegalias, tá? Em região ali do hilo hepático, tá? Que sejam significativas, tá? Existem múltiplas dessas lesões, tá? No fígado aí, possivelmente o número delas é...\n[12:35] [barulho]\n[12:51] ...superior a dez, tá? A gente nota alguns linfonodos ali em topografia próxima ao hilo hepático e perigástrica ali, tá? Junto à curvatura menor do estômago, tá? Todos aparentemente subcentimétricos no menor eixo, tá?\n[13:06] ...com até 0,8 centímetros, podem ser linfonodo de aspecto reacional. Não vejo linfonodomegalias exuberantes. As veias todas pérveas, sem dilatação das veias biliares, tá? A vesícula biliar ok, o baço ok. Não vejo esplenomegalia, não vejo outras alterações...\n[13:21] ...que possam sugerir, por exemplo, outras alterações, tá? A veia cava e o restante aí tudo ok.\n[13:36] A aorta também, tá? Os rins também de aspecto preservado, tá? Vejo um pequeno cisto de aspecto aparentemente simples, tá? Ou mas de pequenas dimensões...\n[13:51] [barulho]\n[14:05] ...aí ele é no não dá pra saber se é um Bosniak 1 ou barra 2 por conta das pequenas dimensões ali no terço entre o terço médio e polo inferior do rim direito, esquerdo, tá? Rim esquerdo, com cerca de menos de 0,4 centímetros, tá?\n[14:20] [barulho]\n[14:34] ...um baço acessório, tá? Junto ao hilo esplênico com cerca de 1,0 centímetros, as adrenais preservadas, não vejo alterações significativas nas porções visualizadas dos campos pulmonares inferiores, pâncreas também ok, tá?\n[14:48] Estômago parcialmente colabado, mas sem a evidência de alterações significativas e nos segmentos intestinais visualizados aqui também não evidencio alterações significativas, tá? No arcabouço ósseo também é restrita a avaliação...\n[15:02] ...mas não vejo lesões ósseas suspeitas ou coisas do tipo, tá? Nem massas na porção visualizada aqui no campo de estudo relacionado pelo menos ao abdômen superior, tá? É importante que agora você dê o laudo, tá?\n[15:16] ...e coloque também na impressão os diagnósticos mais prováveis, tá? Do sendo considerada aqueles mais prováveis pro menos provável possível, tá? O que é quais os achados aí que favorecem mais eles...\n[15:30] ...e quais os que menos favorecem, tá? Que favorecem, não favorecem esse diagnóstico, a ordem deles, tá? Colocar os o diagnóstico também, tá?\n[15:45] E assim e veja os ar... eu preciso que você veja também os arquivos ali em em consideração os arquivos em anexo, tá? De referência que você deve ler lê-los, tá? Para que você possa inferir um diagnóstico. É importante que você leia esses...\n[15:59] ...esses arquivos na íntegra para ter um conhecimento profundo dos possíveis diagnósticos etc, tá? E recomendações e tudo mais, tá? Coloque eles na referência...\n[16:13] [barulho]\n[16:26] ...e não vejo líquido livre aqui, tá? E basicamente é isso. É importante que você também coloque não a necessidade de colocar como é feito o cálculo do wash-in, wash-out, mas é mandatório que você pelo menos coloque aí, tá? O valor do wash-in e o wash-out, tá?\n[16:41] [barulho]",
  "exam_data": {
    "raw_markdown": "",
    "notes": ""
  },
  "prior_reports": {
    "raw_markdown": ""
  },
  "attachments_summary": null,
  "source": {
    "format": "markdown",
    "path": "tests/golden-set/golden_test/p3/input.md"
  },
  "raw_input_markdown": "# CADASTRO DO ATENDIMENTO\n- **OS:** [REDACTED_OS]\n- **Paciente:** PACIENTE_P3\n- **Exame:** RMABSHEP\n- **Data:** 20/01/2026\n\n# RESUMO CLÍNICO (DADOS ADMINISTRATIVOS E ASSISTENCIAIS)\nResumo Clínico Estruturado\n\nPaciente: PACIENTE_P3\nID/Prontuário: [REDACTED_ID]\nIdade/Sexo: 37 anos, Masculino\nConvênio: [REDACTED_CONVENIO]\nTipo de exame: RM Abdome Superior com Contraste Hepatoespecífico\nData/Hora: [REDACTED_DATETIME]\nLocal/Serviço: [REDACTED_LOCAL]\nMédico: [REDACTED_MEDICO]\n\n1. RESUMO EXECUTIVO\n• Avaliação de múltiplos nódulos hepáticos com discrepância diagnóstica entre USG (normal), TC (hemangioma) e RM prévia (abscesso).\n\n2. PERGUNTA CLÍNICA\n• Dúvida principal: Diferenciação etiológica de nódulos hepáticos (Hemangioma vs Abscesso vs Necrose).\n• Indicação literal: COM CONTRASTE HEPATESPECIFICO - MELHOR CARACTERIZAÇÃO DE NODULOS HEPATICOS.\n• Sintoma principal + tempo: Avaliação de nódulo hepático; tratamento para H. Pylori há 1 semana.\n\n3. HISTÓRIA DA DOENÇA ATUAL\n• Início/evolução/intensidade: Achados incidentais em exames de imagem com laudos divergentes\n• Sinais/sintomas-chave: Assintomático para febre, vômitos ou perda ponderal.\n• Hipóteses consideradas: Hemangioma, Abscesso hepático, Lesões necróticas.\n\n4. CIRURGIA E PROCEDIMENTOS PRÉVIOS\n• Nega cirurgias prévios no abdome ou pelve.\n\n5. ANTECEDENTES E COMORBIDADES\n• Oncologia: Nega histórico pessoal de câncer.\n• Doenças crônicas relevantes: Histórico de patologia no fígado não especificada.\n• Infecções recentes: Infecção por H. Pylori relatada há 1 semana.\n\n6. MEDICAÇÕES E CONDIÇÕES QUE MUDAM CONDUTA\n• Antibioticoterapia/tratamento para H. Pylori em curso.\n\n7. ALERGIA E SEGURANÇA\n• Alergia a contraste iodado: Nega.\n• RM: Portador de implantes dentários e tatuagens.\n• Função renal: Nega insuficiência renal.\n• Gestação: Não aplicável.\n\n8. LABORATÓRIO RELEVANTE\n• Não constam resultados laboratoriais nos documentos analisados.\n\n9. EXAMES PRÉVIOS E COMPARATIVOS\n• Exames anteriores: USG (12/12) normal; TC sugerindo hemangiomas; RM anterior sugerindo abscessos.\n• Achados prévios-chave: Lesão no Segmento VI (3,8 x 2,3 cm), Segmento II (2,2 x 1,6 cm) e nódulos nos Segmentos IVA/IVB (1,0 cm) com restrição à difusão.\n\n10. STATUS OPERACIONAL\n• Contraste: Primovist (10ml IV) administrado em 20/01/2026.\n• Pré-medicações: Buscopan simples (1 ampola).\n• Peso/IMC: [DIVERGENTE] 85kg e 87kg registrados; Altura: 1,72m.\n• Intercorrências: Nenhuma intercorrência durante o exame.\n\n11. TEXTO DO PEDIDO (LEGÍVEL)\n• Ressonância nuclear magnética de abdome superior COM CONTRASTE HEPATESPECIFICO. TUSS: 41101170. INDICAÇÃO? MELHOR CARACTERIZAÇÃO DE NODULOS HEPATICOS. PACIENTE COM VARIOS EXAMES DE IMAGEM COM LAUDOS DIFERENTES. USG DE ABDOME DE 12/12 NORMAL; TC MOSTRANDO NODULOS SUGESTIVOS DE HEMANGIOMA; RNM MOSTRANDO NODULOS SUGESTIVOS DE ABCESSO. RNM DE ABDOME; LESOES HEPATICAS DE ETIOLOGIA INDETERMINADA A ESCLARECER. A POSSIBILIDADE DE LESOES LIQUEFEITAS / NECROTICAS OU ATE MESMO ABSCESSOS DEVEM SER CONSIDERADOS NO DIGNOSTICO DIFERENCIAL. LESOES DE 3,8X2,3 CM EM SEGUIMENTO VI, E SEGMENTO II DE 2,2X1,6 CM. HA OUTRAS DUAS FORMAÇOES NODULARES MENORES NO SEGMENTO IVA E IV B, COM APARENTE RESTRIÇAO A DIFUSAO MEDINDO 1CM, INDETERMINADAS.\n\n# LAUDOS PRÉVIOS NA ÍNTEGRA (DOCUMENTO ORIGINAL)\n\n# TRANSCRIÇÕES DE DITADO\n[00:00] [barulho] múltiplas lesões hepáticas, tá?\n[00:09] Essas lesões elas exibem...\n[00:14] ...um leve hipersinal em T2, tá?\n[00:28] Levemente hiperintenso, na verdade hiperintenso em T2, com halo periférico espesso bem definido de maior hipointensidade, mas ainda hiperintenso em relação ao parênquima...\n[00:42] ...e uma área central bem delimitada ainda de maior hiperintensidade, tá? Normalmente são ovaladas, estão esparsas, tá?\n[00:51] ...exceto por duas que exibem aspecto mais confluente ali e possivelmente estão agrupadas ali, tá?\n[01:00] Na região ali da projeção do segmento hepático...\n[01:15] ...do segmento hepático seis, né?\n[01:24] Essas lesões, tá? Elas têm um marcado hipersinal em T2 na porção central, né? Nas sequências em...\n[01:37] ...não exibem presença de gordura, tá? São hipointensas em T1, tá?\n[01:47] Com a porção central mais hipointensa em T1, tá? Sem componente gorduroso...\n[01:59] [barulho]\n[02:12] Sem aparentes focos de hemorragia bem definido, tá?\n[02:23] As duas lesões ali possivelmente confluente ali no segmento hepático seis, elas exibem um mínimo aparente alteração perfusional adjacente com leve...\n[02:38] ...un aparente edema também com hipersinal em T2 bem discreto periférico, tá? Muito discreto, até difícil. Avaliação de algumas fases pós-contraste foi limitado um pouco por conta dos artefatos, tá?\n[02:51] Em relação às sequências em difusão, tá?\n[03:02] [barulho]\n[03:14] A gente nota nas sequências com elevado valor de B, né? Que aparentemente todas essas lesões, tá?\n[03:23] Elas exibem uma porção periférica, tá? Uma restrição de difusão em halo aí, tá?\n[03:37] Com hipersinal marcado aí na no em B elevado, tá? E um ADC, tá? Na porção periférica por vezes estimado em até 1,4 vezes 10 a menos 3, tá?\n[03:52] Com maior hipossinal lá na porção periférica, por vezes até 1,3 vezes 10 a menos 3. E a porção central aparentemente não restringe, tem um efeito de T2 shine-through, tá?\n[04:06] Mostrando um elevado hipersinal no ADC com até 2,3 vezes 10 a menos 3, tá?\n[04:20] Aí, a fase arterial ela ficou um pouco mais difícil a avaliação, né?\n[04:33] Mas a gente nota o seguinte, tá? Preciso que faça o cálculo do wash-in e eventual wash-out pra gente ter melhor certeza, tá? Das alterações...\n[04:47] [barulho]\n[05:00] A fase então arterial ficou bem prejudicada, tá? Mas são medidas aqui, tá?\n[05:13] Primeiramente eu vou medir a porção periférica dessas lesão quanto a a possibilidade aí de realce, tá?\n[05:26] [barulho]\n[05:40] [barulho]\n[05:52] Então aí foi no sem contraste aí, né? 226 na porção periférica do halo, tá? Sem contraste. Na fase...\n[06:04] ...arterial é bem limitado, tá? Mas exibindo determinadas regiões aí com até, por exemplo, 382.\n[06:18] Aí no fase portal, tá? Medindo essas determinadas regiões aí mais na periferia com até 417, tá?\n[06:28] E na fase de equilíbrio, tá? Com até 384.\n[06:43] Na verdade, somente corrigindo, na fase portal, tá? Com 393, tá?\n[06:54] Aí na fase hepatobiliar, tá? Medindo...\n[07:08] [barulho]\n[07:21] ...essas regiões aí por exemplo cerca de 384, tá? Com 10 minutos. Com 15 minutos, tá?\n[07:34] Medindo aí cerca de 344, né? E com cerca aí de 20 minutos, tá?\n[07:47] Regiões aí medindo até 341, tá? Agora em relação a porção central, tá?\n[08:00] Na sem contraste aí mediu 160, tá? Na...\n[08:09] ...fase arterial cerca de 181. Na...\n[08:22] ...portal aí cerca de 152, tá? Na equilíbrio 160.\n[08:34] Aí na hepatobiliar aí com 10 minutos, tá? 186.\n[08:47] Tá? Com cerca de 15 minutos, tá? 220 e com cerca aí de 20 minutos, tá? 207.\n[09:00] Enquanto isso o realce do parênquima adjacente aí normal, tá? É de cerca de 296 no sem contraste, tá? No arterial...\n[09:13] ...355. No portal 473, tá? No equilíbrio 495. No hepatobiliar com 10 minutos 574. No hepatobiliar com 15 minutos 602 e no hepatobiliar com...\n[09:26] ...20 minutos 585, tá? Faça todos os cálculos de wash-in, wash-out pra gente ver melhor, tá? Estas alterações aí, tá?\n[09:40] O realce aparentemente aí na porção central esboça por vezes, não sei se realça ou não, mas tem um aspecto heterogêneo no pós-contraste, tá? A porção periférica forma um halo bem definido aí...\n[09:55] ...com um como se fosse com dois halos, na verdade com uma cápsula mais espessa onde foi feito essas medidas aí, tá?\n[10:08] Não vejo um o realce é mais evidente na fase arterial que tem um leve hiper alteração de realce da porção mais periférica daquelas duas lesões ali no e algumas lesões periféricas, tá?\n[10:22] Aí esse hiper-realce transitório, mas a avaliação é limitado por conta dos artefatos, tá? Não vejo sinais de cirrose, não vejo evidência de esteatose significativa, tá? As dimensões...\n[10:36] ...hepáticas aparentemente normal, tá? Não vejo sinais de dimensões aumentadas hepáticas com o fígado aí medindo no maior eixo longitudinal à direita 9,5, tá? À esquerda, tá? com até...\n[10:49] ...6,4. O as veias hepáticas ok. Veia porta também...\n[11:02] ...sem alterações relevantes, pérveas, tá? Eu não vejo as lesões aí, tá? Aquelas duas maiores na projeção ali do segmento hepático seis, tá?\n[11:13] Elas formam uma única agrupada, que mede na sua maior extensão cerca de 4,4 centímetros, sendo elas duas compostas aí por duas lesões aparentemente...\n[11:27] ...agrupadas que medem cada uma 2,5 centímetros e 2,3 centímetros aproximadamente, tá? É visualizada uma lesão ali na na porção periférica do segmento hepático dois, tá?\n[11:41] Medindo aquela lesão na porção periférica ali cerca de...\n[11:55] ...2,2 centímetros, tá? Basicamente todas as lesões têm um comportamento parecido, tá? Uma outra...\n[12:08] ...essas então são as maiores lesões aí descritas, tá? Observa-se ainda uma na porção periférica do segmento hepático sete, tá? E que mede aí cerca de 1,9 centímetros, todas as outras medindo menos, tá?\n[12:21] Não vejo linfonodomegalias, tá? Em região ali do hilo hepático, tá? Que sejam significativas, tá? Existem múltiplas dessas lesões, tá? No fígado aí, possivelmente o número delas é...\n[12:35] [barulho]\n[12:51] ...superior a dez, tá? A gente nota alguns linfonodos ali em topografia próxima ao hilo hepático e perigástrica ali, tá? Junto à curvatura menor do estômago, tá? Todos aparentemente subcentimétricos no menor eixo, tá?\n[13:06] ...com até 0,8 centímetros, podem ser linfonodo de aspecto reacional. Não vejo linfonodomegalias exuberantes. As veias todas pérveas, sem dilatação das veias biliares, tá? A vesícula biliar ok, o baço ok. Não vejo esplenomegalia, não vejo outras alterações...\n[13:21] ...que possam sugerir, por exemplo, outras alterações, tá? A veia cava e o restante aí tudo ok.\n[13:36] A aorta também, tá? Os rins também de aspecto preservado, tá? Vejo um pequeno cisto de aspecto aparentemente simples, tá? Ou mas de pequenas dimensões...\n[13:51] [barulho]\n[14:05] ...aí ele é no não dá pra saber se é um Bosniak 1 ou barra 2 por conta das pequenas dimensões ali no terço entre o terço médio e polo inferior do rim direito, esquerdo, tá? Rim esquerdo, com cerca de menos de 0,4 centímetros, tá?\n[14:20] [barulho]\n[14:34] ...um baço acessório, tá? Junto ao hilo esplênico com cerca de 1,0 centímetros, as adrenais preservadas, não vejo alterações significativas nas porções visualizadas dos campos pulmonares inferiores, pâncreas também ok, tá?\n[14:48] Estômago parcialmente colabado, mas sem a evidência de alterações significativas e nos segmentos intestinais visualizados aqui também não evidencio alterações significativas, tá? No arcabouço ósseo também é restrita a avaliação...\n[15:02] ...mas não vejo lesões ósseas suspeitas ou coisas do tipo, tá? Nem massas na porção visualizada aqui no campo de estudo relacionado pelo menos ao abdômen superior, tá? É importante que agora você dê o laudo, tá?\n[15:16] ...e coloque também na impressão os diagnósticos mais prováveis, tá? Do sendo considerada aqueles mais prováveis pro menos provável possível, tá? O que é quais os achados aí que favorecem mais eles...\n[15:30] ...e quais os que menos favorecem, tá? Que favorecem, não favorecem esse diagnóstico, a ordem deles, tá? Colocar os o diagnóstico também, tá?\n[15:45] E assim e veja os ar... eu preciso que você veja também os arquivos ali em em consideração os arquivos em anexo, tá? De referência que você deve ler lê-los, tá? Para que você possa inferir um diagnóstico. É importante que você leia esses...\n[15:59] ...esses arquivos na íntegra para ter um conhecimento profundo dos possíveis diagnósticos etc, tá? E recomendações e tudo mais, tá? Coloque eles na referência...\n[16:13] [barulho]\n[16:26] ...e não vejo líquido livre aqui, tá? E basicamente é isso. É importante que você também coloque não a necessidade de colocar como é feito o cálculo do wash-in, wash-out, mas é mandatório que você pelo menos coloque aí, tá? O valor do wash-in e o wash-out, tá?\n[16:41] [barulho]"
}
