{
  "case_id": "p10",
  "case_metadata": {
    "fields": {
      "Paciente": "PACIENTE_P10",
      "OS": "[REDACTED_OS]",
      "Exame": "TCABS+PELVE",
      "Data": "20/01/2026"
    },
    "raw_markdown": "- **Paciente:** PACIENTE_P10\n- **OS:** [REDACTED_OS]\n- **Exame:** TCABS+PELVE\n- **Data:** 20/01/2026"
  },
  "clinical_context": {
    "raw_markdown": "Resumo Clínico Estruturado\n\nPaciente: PACIENTE_P10\nID/Prontuário: [REDACTED_ID]\nIdade/Sexo: 91 anos, Masculino\nConvênio: [REDACTED_CONVENIO]\nTipo de exame: Tomografia Computadorizada de Abdome Superior e Pelve\nProtocolo: Sem contraste (por opção familiar)\nData/Hora: [REDACTED_DATETIME]\nLocal/Serviço: [REDACTED_LOCAL]\nMédico: [REDACTED_MEDICO]\n\n1. RESUMO EXECUTIVO\n• Paciente idoso investigando dor em FIE, emagrecimento e constipação intestinal crônica agudizada. Exame realizado sem contraste devido a restrição familiar por historico alergico\n\n2. PERGUNTA CLÍNICA\n• Dúvida principal: Investigar dor em FIE e perda de peso.\n• Indicação literal: TC Abdome total com contraste. - Dor FIE emagrecimento\n• Sintoma principal + tempo: Dor abdominal difusa (piora há 1 mês) e constipação (6 meses).\n\n3. HISTÓRIA DA DOENÇA ATUAL\n• Início/evolução/intensidade: Constipação de longa data com piora importante nos últimos 6 meses. Dor abdominal difusa há anos, com agudização no último mês.\n• Sinais/sintomas-chave: Dor localizada em fossa ilíaca esquerda e perda ponderal.\n• Hipóteses consideradas (máx 3): Doença diverticular, neoplasia intestinal, transtorno funcional obstrutivo.\n\n4. CIRURGIA E PROCEDIMENTOS PRÉVIOS\n• Prostatectomia parcial (BPH) e hernioplastia inguinal esquerda há aproximadamente 10 anos.\n\n5. ANTECEDENTES E COMORBIDADES\n• Oncologia: Nega neoplasias prévias.\n• Doenças crônicas relevantes: Hipertensão, cardiopatia e insuficiência renal crônica.\n• Histórico familiar/gineco-obstétrico: Relato de cólica renal prévia.\n\n6. MEDICAÇÕES E CONDIÇÕES QUE MUDAM CONDUTA\n• Em uso de Puran e Benicar.\n\n7. ALERGIA E SEGURANÇA\n• Alergia a contraste iodado: Relato familiar de alergia a iodo e antitérmicos, embora o paciente nunca tenha sido exposto ao contraste anteriormente.\n• Função renal (creatinina/eTFG + data): Creatinina 1,38; Clearance 48 (14/01/2026).\n• RM: Não aplicável.\n• Corpos metálicos: Não informados.\n• Gestação: Não aplicável.\n\n8. LABORATÓRIO RELEVANTE\n• Creatinina elevada (1,38 mg/dL) com taxa de filtração glomerular reduzida (48 ml/min).\n\n9. EXAMES PRÉVIOS E COMPARATIVOS\n• Exames anteriores (data/local/serviço): Histórico de RX e US no Sabin.\n\n10. STATUS OPERACIONAL\n• Contraste (tipo/via/quantidade): Exame realizado sem contraste por recusa da família (termo assinado).\n• Pré-medicações (Buscopan/manitol/gel vaginal): Nenhuma informada.\n• Jejum/preparo: Realizado sem contraste, contrariando o pedido inicial por seguranca alergica\n• Peso/IMC: Divergência entre 65kg e 70kg; Altura entre 1,56m e 1,60m.\n\n11. TEXTO DO PEDIDO (LEGÍVEL)\n• TC Abdome total com contraste. Motivo: Dor FIE e emagrecimento. Data: [REDACTED_DATE]."
  },
  "dictation_raw": "[00:00] [ruído]\n[00:01] Boa noite, foi feito o vídeo devido a essa...\n[00:07] ...arte com parafusos metálicos de fixação intramedular ali de provável fratura na região do colo femoral...\n[00:19] ...esquerdo, tá?\n[00:22] Aqui notáveis aqui uma interposição gasosa aqui sinais de Chilaiditi do colo direito ali e o superfície hepática, tá? Pelo menos...\n[00:29] ...visível, sem...\n[00:32] ...não consegui visualizar no atual campo de estudo aqui sinais de massa hepática, embora avaliação de lesões seja bem limitada, tá?\n[00:38] Nem os vasos direito é visualizado, tá? Mas eu vejo a perviedade deles limitada, mas eu não vejo sinais de dilatações aneurismáticas.\n[00:43] Eu vejo uma aterosclerose aórtica difusa com tortuosidades aí da aorta abdominal, tá? Mas não consigo identificar pontos aneurismáticos, tá?\n[00:52] E essa ateromatose é por todo território aí ilíaco e femoral também, tá?\n[01:00] [pausa]\n[01:05] Eu vejo então ali a vesícula biliar parcialmente repleta, avaliação limitada mas sem evidência de cálculos notavelmente radiodenso, tá? Na região...\n[01:13] ...pelo menos ali do... as adrenais preservadas, baço também okay pelo menos ao método.\n[01:18] Pâncreas também sem alterações significativas, tá? Pelo menos visíveis.\n[01:22] O... uma possibilidade de uma discreta hérnia hiatal, tá? O estômago colapsado, avaliação bem limitada mas sem evidência de outras alterações significativas, arcada duodenal ali também, tá?\n[01:31] As alças intestinais aí aparentemente bem distribuídas, tá? As jejunais e tanto ileais, embora esta avaliação seja parcialmente limitada, tá? Uma com uma mínima subdistensão.\n[01:41] A gente nota ali na topografia um apêndice vermiforme okay, junção ileocecal também okay, sem evidência de massa nos segmentos cólicos aí distendidos por conteúdo fecal, alguns pequenos divertículos sem acometimento inflamatório em atividade, tá?\n[01:54] Leve colapso parcial, uma importante redundância do cólon sigmoide que exibe múltiplos divertículos e se insinua até a porção superior lá do mesogástrio, tá?\n[02:03] Uma mínima coprostase retal, mas sem evidências de lesões expansivas pelo menos detectáveis ao estudo sem contraste.\n[02:12] Não vejo alterações significativas detectáveis ao exame de imagem na região da fossa ilíaca esquerda, tá?\n[02:18] A gente nota sinais de abordagem cirurgica na região da loja prostática, com uma imagem hipoatenuante ali ao longo da linha média que pode estar relacionado a ressecção ou artefato, tá?\n[02:30] Não sabe a via de ressecção prostática, mas a avaliação é muito limitada ainda mais pelo método tomográfico sem contraste e por conta de artefato de endurecimento de feixe, mas sem evidência de alterações.\n[02:41] Flebólitos ali na cavidade pélvica, tá?\n[02:45] Bexiga parcialmente repleta, avaliação muito limitada, pode haver espessamento das paredes mas a avaliação é limitada devido à baixa repleção vesical, tá?\n[02:52] [pausa]\n[02:56] A gente nota aí as adrenais então preservadas, tá?\n[03:01] A presença de inúmeros cistos renais bilaterais, tá?\n[03:05] [pausa]\n[03:14] Com pelo menos, podem... mais de dez cistos aí de cada lado, tá? A avaliação é limitada devido à ausência de contraste, tá?\n[03:23] Podem ser aqui a maioria que deve ser possivelmente um Bosniak dois, tá?\n[03:30] Inclusive um deles tem até uma calcificação periférica na região mais inferior ali do rim esquerdo, tá? Múltiplos exofíticos de variados tamanhos, tá?\n[03:44] Destaque aí por exemplo para um, tá? No rim esquerdo, no polo inferior medindo aí cerca de seis virgula quatro centímetros no maior eixo do plano axial.\n[03:52] Outro no polo inferior do rim direito também medindo cerca aí de cinco virgula um centímetros no maior eixo do plano axial.\n[03:59] Mínimo edema dos planos adiposos perirrenais bilaterais, mínimo espessamento aí do peritônio mas que pode ser por conta ao certo grau de edema mas não é de aspecto nodular, tá?\n[04:07] Uma provável hérnia inguinal com acometimento indireto à direita, tá? Com saco herniário aí medindo transversamente cerca de quatro virgula dois centímetros, tá?\n[04:15] E a medida ali do defeito do colo com até cerca de dois virgula zero centímetros.\n[04:23] À esquerda tem uma insinuação de tecido gorduroso, mas não dá para diferenciar entre hérnia e lipomatose, ainda mais sem manobras de esforço, tá?\n[04:30] Uma cicatriz cirurgica na parede abdominal inferior ao longo da linha média, sem evidência de aparentes complicações.\n[04:37] Uma possível hérnia umbilical com conteúdo gorduroso, mas um diagnóstico diferencial importante que não dá para descartar aqui também é de proeminência de tecido gorduroso na região da cicatriz umbilical, tá?\n[04:44] Sem ascite significativa, tá?\n[04:48] Múltiplo... essa haste metálica intramedular na topografia do colo femoral à esquerda, tá? Para provável fratura.\n[04:57] Múltiplas alterações degenerativas aí pela coluna vertebral, articulações gleno... articulações fêmuro-acetabulares bilaterais, tá?\n[05:05] Também importante com redução do espaço articular, alterações degenerativas difusas, tá?\n[05:13] Redução difusa da textura mineral óssea, tá? Uma alterações degenerativas difusas aí pela coluna.\n[05:22] Uma provável fratura com compressão ali e deformidade com redução da altura do corpo vertebral de T doze, tá?\n[05:29] Mas a avaliação é parcialmente limitada.\n[05:38] Um desvio escoliótico da coluna lombar para a esquerda e torácica possivelmente para a direita, tá?\n[05:45] Esses são os achados aí de maior significado.\n[05:49] E na região do tórax, só algumas opacidades aí provavelmente relacionadas a hipoventilação, decúbito, tá?\n[05:55] Mas e possíveis pequenos granulomas calcificados residuais bilaterais, tá? E esses são os achados, tá?\n[06:02] Parcialmente visualizado ali possivelmente uma ectasia difusa da porção ascendente da aorta torácica com até quatro virgula quatro centímetros, tá?\n[06:10] Parcialmente visibilizada, a avaliação bem limitada, tá?\n[06:16] [ruído]",
  "exam_data": {
    "raw_markdown": "",
    "notes": ""
  },
  "prior_reports": {
    "raw_markdown": ""
  },
  "attachments_summary": null,
  "source": {
    "format": "markdown",
    "path": "tests/golden-set/golden_test/p10/input.md"
  },
  "raw_input_markdown": "# CADASTRO DO ATENDIMENTO\n- **Paciente:** PACIENTE_P10\n- **OS:** [REDACTED_OS]\n- **Exame:** TCABS+PELVE\n- **Data:** 20/01/2026\n\n# RESUMO CLÍNICO (DADOS ADMINISTRATIVOS E ASSISTENCIAIS)\nResumo Clínico Estruturado\n\nPaciente: PACIENTE_P10\nID/Prontuário: [REDACTED_ID]\nIdade/Sexo: 91 anos, Masculino\nConvênio: [REDACTED_CONVENIO]\nTipo de exame: Tomografia Computadorizada de Abdome Superior e Pelve\nProtocolo: Sem contraste (por opção familiar)\nData/Hora: [REDACTED_DATETIME]\nLocal/Serviço: [REDACTED_LOCAL]\nMédico: [REDACTED_MEDICO]\n\n1. RESUMO EXECUTIVO\n• Paciente idoso investigando dor em FIE, emagrecimento e constipação intestinal crônica agudizada. Exame realizado sem contraste devido a restrição familiar por historico alergico\n\n2. PERGUNTA CLÍNICA\n• Dúvida principal: Investigar dor em FIE e perda de peso.\n• Indicação literal: TC Abdome total com contraste. - Dor FIE emagrecimento\n• Sintoma principal + tempo: Dor abdominal difusa (piora há 1 mês) e constipação (6 meses).\n\n3. HISTÓRIA DA DOENÇA ATUAL\n• Início/evolução/intensidade: Constipação de longa data com piora importante nos últimos 6 meses. Dor abdominal difusa há anos, com agudização no último mês.\n• Sinais/sintomas-chave: Dor localizada em fossa ilíaca esquerda e perda ponderal.\n• Hipóteses consideradas (máx 3): Doença diverticular, neoplasia intestinal, transtorno funcional obstrutivo.\n\n4. CIRURGIA E PROCEDIMENTOS PRÉVIOS\n• Prostatectomia parcial (BPH) e hernioplastia inguinal esquerda há aproximadamente 10 anos.\n\n5. ANTECEDENTES E COMORBIDADES\n• Oncologia: Nega neoplasias prévias.\n• Doenças crônicas relevantes: Hipertensão, cardiopatia e insuficiência renal crônica.\n• Histórico familiar/gineco-obstétrico: Relato de cólica renal prévia.\n\n6. MEDICAÇÕES E CONDIÇÕES QUE MUDAM CONDUTA\n• Em uso de Puran e Benicar.\n\n7. ALERGIA E SEGURANÇA\n• Alergia a contraste iodado: Relato familiar de alergia a iodo e antitérmicos, embora o paciente nunca tenha sido exposto ao contraste anteriormente.\n• Função renal (creatinina/eTFG + data): Creatinina 1,38; Clearance 48 (14/01/2026).\n• RM: Não aplicável.\n• Corpos metálicos: Não informados.\n• Gestação: Não aplicável.\n\n8. LABORATÓRIO RELEVANTE\n• Creatinina elevada (1,38 mg/dL) com taxa de filtração glomerular reduzida (48 ml/min).\n\n9. EXAMES PRÉVIOS E COMPARATIVOS\n• Exames anteriores (data/local/serviço): Histórico de RX e US no Sabin.\n\n10. STATUS OPERACIONAL\n• Contraste (tipo/via/quantidade): Exame realizado sem contraste por recusa da família (termo assinado).\n• Pré-medicações (Buscopan/manitol/gel vaginal): Nenhuma informada.\n• Jejum/preparo: Realizado sem contraste, contrariando o pedido inicial por seguranca alergica\n• Peso/IMC: Divergência entre 65kg e 70kg; Altura entre 1,56m e 1,60m.\n\n11. TEXTO DO PEDIDO (LEGÍVEL)\n• TC Abdome total com contraste. Motivo: Dor FIE e emagrecimento. Data: [REDACTED_DATE].\n\n# LAUDOS PRÉVIOS NA ÍNTEGRA (DOCUMENTO ORIGINAL)\n\n# TRANSCRIÇÕES DE DITADO\n[00:00] [ruído]\n[00:01] Boa noite, foi feito o vídeo devido a essa...\n[00:07] ...arte com parafusos metálicos de fixação intramedular ali de provável fratura na região do colo femoral...\n[00:19] ...esquerdo, tá?\n[00:22] Aqui notáveis aqui uma interposição gasosa aqui sinais de Chilaiditi do colo direito ali e o superfície hepática, tá? Pelo menos...\n[00:29] ...visível, sem...\n[00:32] ...não consegui visualizar no atual campo de estudo aqui sinais de massa hepática, embora avaliação de lesões seja bem limitada, tá?\n[00:38] Nem os vasos direito é visualizado, tá? Mas eu vejo a perviedade deles limitada, mas eu não vejo sinais de dilatações aneurismáticas.\n[00:43] Eu vejo uma aterosclerose aórtica difusa com tortuosidades aí da aorta abdominal, tá? Mas não consigo identificar pontos aneurismáticos, tá?\n[00:52] E essa ateromatose é por todo território aí ilíaco e femoral também, tá?\n[01:00] [pausa]\n[01:05] Eu vejo então ali a vesícula biliar parcialmente repleta, avaliação limitada mas sem evidência de cálculos notavelmente radiodenso, tá? Na região...\n[01:13] ...pelo menos ali do... as adrenais preservadas, baço também okay pelo menos ao método.\n[01:18] Pâncreas também sem alterações significativas, tá? Pelo menos visíveis.\n[01:22] O... uma possibilidade de uma discreta hérnia hiatal, tá? O estômago colapsado, avaliação bem limitada mas sem evidência de outras alterações significativas, arcada duodenal ali também, tá?\n[01:31] As alças intestinais aí aparentemente bem distribuídas, tá? As jejunais e tanto ileais, embora esta avaliação seja parcialmente limitada, tá? Uma com uma mínima subdistensão.\n[01:41] A gente nota ali na topografia um apêndice vermiforme okay, junção ileocecal também okay, sem evidência de massa nos segmentos cólicos aí distendidos por conteúdo fecal, alguns pequenos divertículos sem acometimento inflamatório em atividade, tá?\n[01:54] Leve colapso parcial, uma importante redundância do cólon sigmoide que exibe múltiplos divertículos e se insinua até a porção superior lá do mesogástrio, tá?\n[02:03] Uma mínima coprostase retal, mas sem evidências de lesões expansivas pelo menos detectáveis ao estudo sem contraste.\n[02:12] Não vejo alterações significativas detectáveis ao exame de imagem na região da fossa ilíaca esquerda, tá?\n[02:18] A gente nota sinais de abordagem cirurgica na região da loja prostática, com uma imagem hipoatenuante ali ao longo da linha média que pode estar relacionado a ressecção ou artefato, tá?\n[02:30] Não sabe a via de ressecção prostática, mas a avaliação é muito limitada ainda mais pelo método tomográfico sem contraste e por conta de artefato de endurecimento de feixe, mas sem evidência de alterações.\n[02:41] Flebólitos ali na cavidade pélvica, tá?\n[02:45] Bexiga parcialmente repleta, avaliação muito limitada, pode haver espessamento das paredes mas a avaliação é limitada devido à baixa repleção vesical, tá?\n[02:52] [pausa]\n[02:56] A gente nota aí as adrenais então preservadas, tá?\n[03:01] A presença de inúmeros cistos renais bilaterais, tá?\n[03:05] [pausa]\n[03:14] Com pelo menos, podem... mais de dez cistos aí de cada lado, tá? A avaliação é limitada devido à ausência de contraste, tá?\n[03:23] Podem ser aqui a maioria que deve ser possivelmente um Bosniak dois, tá?\n[03:30] Inclusive um deles tem até uma calcificação periférica na região mais inferior ali do rim esquerdo, tá? Múltiplos exofíticos de variados tamanhos, tá?\n[03:44] Destaque aí por exemplo para um, tá? No rim esquerdo, no polo inferior medindo aí cerca de seis virgula quatro centímetros no maior eixo do plano axial.\n[03:52] Outro no polo inferior do rim direito também medindo cerca aí de cinco virgula um centímetros no maior eixo do plano axial.\n[03:59] Mínimo edema dos planos adiposos perirrenais bilaterais, mínimo espessamento aí do peritônio mas que pode ser por conta ao certo grau de edema mas não é de aspecto nodular, tá?\n[04:07] Uma provável hérnia inguinal com acometimento indireto à direita, tá? Com saco herniário aí medindo transversamente cerca de quatro virgula dois centímetros, tá?\n[04:15] E a medida ali do defeito do colo com até cerca de dois virgula zero centímetros.\n[04:23] À esquerda tem uma insinuação de tecido gorduroso, mas não dá para diferenciar entre hérnia e lipomatose, ainda mais sem manobras de esforço, tá?\n[04:30] Uma cicatriz cirurgica na parede abdominal inferior ao longo da linha média, sem evidência de aparentes complicações.\n[04:37] Uma possível hérnia umbilical com conteúdo gorduroso, mas um diagnóstico diferencial importante que não dá para descartar aqui também é de proeminência de tecido gorduroso na região da cicatriz umbilical, tá?\n[04:44] Sem ascite significativa, tá?\n[04:48] Múltiplo... essa haste metálica intramedular na topografia do colo femoral à esquerda, tá? Para provável fratura.\n[04:57] Múltiplas alterações degenerativas aí pela coluna vertebral, articulações gleno... articulações fêmuro-acetabulares bilaterais, tá?\n[05:05] Também importante com redução do espaço articular, alterações degenerativas difusas, tá?\n[05:13] Redução difusa da textura mineral óssea, tá? Uma alterações degenerativas difusas aí pela coluna.\n[05:22] Uma provável fratura com compressão ali e deformidade com redução da altura do corpo vertebral de T doze, tá?\n[05:29] Mas a avaliação é parcialmente limitada.\n[05:38] Um desvio escoliótico da coluna lombar para a esquerda e torácica possivelmente para a direita, tá?\n[05:45] Esses são os achados aí de maior significado.\n[05:49] E na região do tórax, só algumas opacidades aí provavelmente relacionadas a hipoventilação, decúbito, tá?\n[05:55] Mas e possíveis pequenos granulomas calcificados residuais bilaterais, tá? E esses são os achados, tá?\n[06:02] Parcialmente visualizado ali possivelmente uma ectasia difusa da porção ascendente da aorta torácica com até quatro virgula quatro centímetros, tá?\n[06:10] Parcialmente visibilizada, a avaliação bem limitada, tá?\n[06:16] [ruído]"
}
