{
  "case_id": "p2",
  "case_metadata": {
    "fields": {
      "Paciente": "PACIENTE_P2",
      "Identificação": "[REDACTED_ID]",
      "Data de Nascimento": "[REDACTED_DOB]",
      "Ordem de Serviço (OS)": "[REDACTED_OS]",
      "Exame": "USG de abdome superior com doppler de veia porta e hepáticas"
    },
    "raw_markdown": "- **Paciente:** PACIENTE_P2\n- **Identificação:** [REDACTED_ID]\n- **Data de Nascimento:** [REDACTED_DOB]\n- **Ordem de Serviço (OS):** [REDACTED_OS]\n- **Exame:** USG de abdome superior com doppler de veia porta e hepáticas"
  },
  "clinical_context": {
    "raw_markdown": "### Indicação Clínica e HD\n- Achado prévio em **RNM** demonstrando **trombose esplênica** com **circulação colateral**.\n- Exame solicitado: **USG de abdome superior com doppler de veia porta e hepáticas**."
  },
  "dictation_raw": "- [00:00 - 00:15] Paciente de cinquenta e três anos sexo feminino pedido médico indicativo de [pausa]\n- [00:15 - 00:42] Ressonância magnética prévia do mesmo serviço mostrando trombose esplênica com circulação colateral tá o fígado não tem sinais de cirrose tem uma aparente esteatose tá coloque como outras patologias de depósito aí nos diferenciais né coloque as medidas foram feitas várias medidas aí das veias e dos vasos a gente nota ainda [pausa]\n- [00:43 - 01:21] Eu não consegui visualizar no atual exame aquela lesão cística na cabeça do pâncreas tá a gente nota ainda essa estrutura alongada aí de aspecto tubuliforme hipoecogênica heterogênea sem vascularização estudo doppler situada na região que se estende ali pela mesma região que foi vista na ressonância ali na região da [pausa] da cauda lá em contato com a face renal esquerda tá com as medidas estimadas em pelo menos [pausa]\n- [03:10 - 04:00] É as medidas inclusive estão apresentando as dimensões aí documentadas como cauda pâncreas tá a medida da lesão eh foi visto ainda alguns vasos ali em topografia perigástrica em continuidade aí com alguns vasos do mesentério poderia sugerir a presença de circulação colateral na região tá o as medidas o bastão aí para cálculo do volume tá é difícil a visualização eh da anatomia e importante falar que ainda continua em continuidade com os vasos ali tá essa lesão então não dá para distinguir se daqui pode ser uma sequela de alguma alteração de como uma coleção de um do passado alguma coleção que ficou de aspecto sequelar fibrosou tudo ou se isso daí pode ser uma sequela de uma trombose também prévia tá já que a paciente refere-se assintomática tudo mas é algo que precisa ser acompanhado mas não vejo outras alterações significativas\n- [04:07 - 04:41] Só aí tem o índice hepatorrenal também por favor coloque ele tá e o significado assim como se baseie nas referências aí anexos tá caso seja necessário pesquise na literatura somente a respeito desses artigos para elaboração do laudo e suas especificidades",
  "exam_data": {
    "raw_markdown": "",
    "notes": ""
  },
  "prior_reports": {
    "raw_markdown": "## LAUDO PRÉVIO [1] — RESSONÂNCIA MAGNÉTICA DE ABDOME TOTAL\n> NOTA: Realizado em 12/12/2025. Fonte: externo\nPré-visualização. Laudo sem valor legal.\n\nNome : PACIENTE_P2\nRG : [REDACTED_RG] Código da OS : [REDACTED_OS]\nDN : [REDACTED_DOB] CPF : [REDACTED_CPF]\nMédico : [REDACTED_MEDICO]\nConvênio: [REDACTED_CONVENIO]\nUnidade : [REDACTED_UNIDADE]\nPágina : 1/5\n\nResponsável Técnico: [REDACTED_RESPONSAVEL]\nLaboratorio registrado no CRM: [REDACTED_REGISTRO]\nEndereço: [REDACTED_ENDERECO]\n\nRESSONÂNCIA MAGNÉTICA DE ABDOME TOTAL\n\nINDICAÇÃO CLÍNICA\n\nElucidação e melhor avaliação de alterações identificadas em tomografia computadorizada prévia, com foco em pâncreas, fígado e linfonodos, em adulto de meia-idade, sexo feminino, com dor em topografia apendicular há cerca de 2 meses e antecedente de pancreatite.\n\nTÉCNICA E PROTOCOLO\n\nEquipamento: Ressonância Magnética de Alto Campo (1,5 T). Foram utilizadas bobinas de corpo e/ou superfície (phased-array).\nSequências adquiridas: Exame multiplanar e multisequencial do abdome e pelve, incluindo sequências ponderadas em T1 (em fase e fora de fase) e T2 (com e sem supressão de gordura), difusão (DWI) e sequências pós-contraste.\nMeio de contraste: Agente de contraste à base de gadolínio - ácido gadotérico (Dotarem®), 15 mL, por via intravenosa.\nPreparo e outros: Jejum. Administrado antiespasmódico (Buscopan®). Recusa de preparo com gel vaginal.\nLimitações técnicas: Lacuna de cobertura entre bobinas na transição abdome superior/inferior, limitando parcialmente a avaliação de estruturas na fossa ilíaca direita e a apreciação pós-contraste nessa topografia. Avaliação do cólon é intrinsecamente limitada pelo método.\n\nACHADOS DE RESSONÂNCIA MAGNÉTICA\n\nFígado\nSem sinais de cirrose. Dimensões preservadas (lobo direito ~13,0 cm; lobo esquerdo ~7,7 cm).\nQueda de sinal em T1 fora de fase, compatível com esteatose leve (ROI: 374 em fase e 349 fora de fase; queda percentual ~6,7%).\nSem lesões focais hepáticas identificadas.\nVesícula biliar e vias biliares extra-hepáticas\nVesícula biliar sem alterações significativas.\nVias biliares intra e extra-hepáticas sem dilatação.\nPâncreas\nCabeça e corpo com dimensões dentro dos limites da normalidade, com realce pós-contraste aparentemente homogêneo. Ducto pancreático afilado, sem dilatação significativa.\nPequena lesão cística unilocular na transição cabeça/colo/corpo pancreático, medindo cerca de 1,0 cm, com hipersinal em T2, sem componente sólido ou septações identificáveis; comunicação com o ducto pancreático não determinada com segurança.\n\nASSINATURA DIGITAL\nFA0C46ED3258\n\n## LAUDO PRÉVIO [2] — RESSONÂNCIA MAGNÉTICA DE ABDOME TOTAL\n> NOTA: Realizado em 12/12/2025. Fonte: externo\nPré-visualização. Laudo sem valor legal.\n\nNome : PACIENTE_P2\nRG : [REDACTED_RG]\nDN : [REDACTED_DOB]\nMédico : [REDACTED_MEDICO]\nConvênio: [REDACTED_CONVENIO]\nUnidade : [REDACTED_UNIDADE]\n\nId. Paciente : [REDACTED_ID]\nCódigo da OS : [REDACTED_OS]\nCPF : [REDACTED_CPF]\nConselho : [REDACTED_CRM] MG\nAtendimento: [REDACTED_DATETIME]\nQnt de exames: 1\nPágina : 2/5\n\nResponsável Técnico: [REDACTED_RESPONSAVEL]\nLaboratorio registrado no CRM: [REDACTED_REGISTRO]\nEndereço: [REDACTED_ENDERECO]\n\n▶ Estrutura tubuliforme alongada em continuidade com a região de corpo/cauda, em amplo contato com a lâmina anterior da fáscia renal à esquerda, com discreto espessamento fascial adjacente e discretas estriações da gordura peri-esplênica/peripancreática.\n▶ A referida estrutura apresenta porção periférica com hipossinal em T2 e leve hiperintensidade em T1 pré-contraste; conteúdo central com hipersinal em T2 e hipossinal em T1, sem realce pós-contraste evidente e com baixa conspicuidade nas sequências pós-contraste.\n▶ Medidas aproximadas: extensão longitudinal ~6,5-6,8 cm; eixos axiais ~2,3 x 1,7 cm; volume aproximado ~13-14 cm³ (V≈0,52×D1×D2×D3).\n▶ Sem restrição significativa à difusão (difusão facilitada).\nBaço\n▶ Dimensões preservadas (maior eixo ~10,7 cm). Sinal e contornos sem particularidades.\nRins\n▶ Rins tópicos, com dimensões preservadas, sem sinais de dilatação do sistema pielocalicinal.\n▶ Sem evidências de lesões renais complexas à RM.\nAdrenais\n▶ Sem alterações significativas.\nBexiga\n▶ Bexiga parcialmente repleta, sem alterações significativas.\n▶ A avaliação do espessamento parietal vesical pode estar limitada pela repleção parcial.\nÓrgãos pélvicos\n▶ Sinais de histerectomia subtotal, com remanescente do colo uterino sem alterações significativas.\n▶ Avaliação vaginal parcialmente limitada (sem gel vaginal).\n▶ Ovário direito não caracterizado com segurança.\n▶ Em topografia anexial esquerda, estrutura compatível com ovário sem sinais suspeitos, com dimensões estimadas ~2,5 x 1,6 x 1,6 cm.\n▶ Cisto compatível com corpo lúteo no anexo esquerdo, medindo ~1,7 cm (O-RADS 2; 17/12/2025).\nEstômago e duodeno\n▶ Sinais de alterações aderenciais com discreto repuxamento/afilamento na transição corpo-antro do estômago.\nIntestino delgado\n▶ Sem dilatação evidente.\nCólon e apêndice cecal\n▶ Avaliação colônica limitada; sem sinais evidentes de obstrução a montante.\n▶ Sinais de alterações aderenciais até a flexura esplênica, com discreto repuxamento e colapso segmentar, sem obstrução associada.\n▶ Estrutura alongada de aspecto cístico, em continuidade e sem plano de clivagem evidente com a porção fúndica do apêndice\nASSINATURA DIGITAL\nFA0C46ED3258\n\n## LAUDO PRÉVIO [3] — Ressonância Magnética de Abdome Total\n> NOTA: Realizado em 12/12/2025. Fonte: [REDACTED_SOURCE]\nPré-visualização. Laudo sem valor legal.\n\nNome : PACIENTE_P2\nRG : [REDACTED_RG] Código da OS : [REDACTED_OS]\nDN : [REDACTED_DOB] CPF : [REDACTED_CPF]\nMédico : [REDACTED_MEDICO]\nConvênio: [REDACTED_CONVENIO]\nUnidade : [REDACTED_UNIDADE]\nPágina : 3/5\n\nResponsável Técnico: [REDACTED_RESPONSAVEL]\nLaboratorio registrado no CRM: [REDACTED_REGISTRO]\nEndereço: [REDACTED_ENDERECO]\n\nvermiforme, com conteúdo hiperintenso em T2, sem componente sólido identificado.\nMedidas aproximadas: extensão longitudinal ~4,4 cm; eixos axiais ~3,8 x 1,8 cm; espessura parietal até ~2,3 mm.\nAvaliação pós-contraste dessa topografia limitada pela lacuna de cobertura entre bobinas.\nVasos abdominais e pélvicos\nVeia porta pérvia, com calibre preservado (~1,0 cm). Veia mesentérica superior pérvia.\nVeia esplênica com importante afilamento distal, com difícil caracterização, levantando a possibilidade de componente\ntrombótico crônico/oclusivo.\nPresença de circulação colateral venosa calibrosa na topografia perigástrica e em vasos do mesocolo/mesentério à\nesquerda, compatível com hipertensão portal segmentar (sinistral).\nVeia renal esquerda circumaórtica.\nLinfonodos retroperitoneais e pélvicos\nAumento do número de linfonodos retroperitoneais, predominantemente subcentimétricos.\nLinfonodomegalias pélvicas, com destaque para cadeias ilíacas externas e obturatórias: à direita ~2,0 x 1,3 cm; à esquerda\n(obturatória) até ~1,8 x 1,0 cm.\nLinfonodomegalias inguinais superficiais bilaterais, em número aumentado, algumas com discretas alterações\ninflamatórias/perinodais.\nMesentério e peritônio\nAusência de ascite.\nDiscretas estriações da gordura adjacentes à região de cauda pancreática/peri-esplênica (conforme descrito).\nSem implantes peritoneais evidentes.\nParede abdominal e pélvica\nCicatriz cirurgica em parede abdominal inferior, sem sinais de complicações evidentes.\nEstruturas ósseas\nSem lesões ósseas focais suspeitas identificadas no campo avaliado.\nBases pulmonares, pleura basal e diafragma\nSem derrame pleural ou alterações grosseiras nas bases pulmonares no campo avaliado.\n\nCOMPARAÇÃO\n\nExame comparado com tomografia computadorizada de abdome e pelve de 05/11/2025 (imagens disponíveis). Observa-se:\nAchado na cauda pancreática, de aspecto tubuliforme/cístico e caráter provavelmente sequelar, em correlação com o exame\nprévio.\nAchados compatíveis com hipertensão portal segmentar à esquerda/circulação colateral associados a provável\ncomprometimento crônico da veia esplênica, em correlação com o exame prévio.\nEstrutura cística em topografia apendicular, novamente identificada, mantendo hipótese de mucocele (melhor caracterização\n\nASSINATURA DIGITAL\nFA0C46ED3258"
  },
  "attachments_summary": null,
  "source": {
    "format": "markdown",
    "path": "tests/golden-set/golden_test/p2/input.md"
  },
  "raw_input_markdown": "# CADASTRO DO ATENDIMENTO\n- **Paciente:** PACIENTE_P2\n- **Identificação:** [REDACTED_ID]\n- **Data de Nascimento:** [REDACTED_DOB]\n- **Ordem de Serviço (OS):** [REDACTED_OS]\n- **Exame:** USG de abdome superior com doppler de veia porta e hepáticas\n\n# RESUMO CLÍNICO (DADOS ADMINISTRATIVOS E ASSISTENCIAIS)\n### Indicação Clínica e HD\n- Achado prévio em **RNM** demonstrando **trombose esplênica** com **circulação colateral**.\n- Exame solicitado: **USG de abdome superior com doppler de veia porta e hepáticas**.\n\n# LAUDOS PRÉVIOS NA ÍNTEGRA (DOCUMENTO ORIGINAL)\n\n## LAUDO PRÉVIO [1] — RESSONÂNCIA MAGNÉTICA DE ABDOME TOTAL\n> NOTA: Realizado em 12/12/2025. Fonte: externo\nPré-visualização. Laudo sem valor legal.\n\nNome : PACIENTE_P2\nRG : [REDACTED_RG] Código da OS : [REDACTED_OS]\nDN : [REDACTED_DOB] CPF : [REDACTED_CPF]\nMédico : [REDACTED_MEDICO]\nConvênio: [REDACTED_CONVENIO]\nUnidade : [REDACTED_UNIDADE]\nPágina : 1/5\n\nResponsável Técnico: [REDACTED_RESPONSAVEL]\nLaboratorio registrado no CRM: [REDACTED_REGISTRO]\nEndereço: [REDACTED_ENDERECO]\n\nRESSONÂNCIA MAGNÉTICA DE ABDOME TOTAL\n\nINDICAÇÃO CLÍNICA\n\nElucidação e melhor avaliação de alterações identificadas em tomografia computadorizada prévia, com foco em pâncreas, fígado e linfonodos, em adulto de meia-idade, sexo feminino, com dor em topografia apendicular há cerca de 2 meses e antecedente de pancreatite.\n\nTÉCNICA E PROTOCOLO\n\nEquipamento: Ressonância Magnética de Alto Campo (1,5 T). Foram utilizadas bobinas de corpo e/ou superfície (phased-array).\nSequências adquiridas: Exame multiplanar e multisequencial do abdome e pelve, incluindo sequências ponderadas em T1 (em fase e fora de fase) e T2 (com e sem supressão de gordura), difusão (DWI) e sequências pós-contraste.\nMeio de contraste: Agente de contraste à base de gadolínio - ácido gadotérico (Dotarem®), 15 mL, por via intravenosa.\nPreparo e outros: Jejum. Administrado antiespasmódico (Buscopan®). Recusa de preparo com gel vaginal.\nLimitações técnicas: Lacuna de cobertura entre bobinas na transição abdome superior/inferior, limitando parcialmente a avaliação de estruturas na fossa ilíaca direita e a apreciação pós-contraste nessa topografia. Avaliação do cólon é intrinsecamente limitada pelo método.\n\nACHADOS DE RESSONÂNCIA MAGNÉTICA\n\nFígado\nSem sinais de cirrose. Dimensões preservadas (lobo direito ~13,0 cm; lobo esquerdo ~7,7 cm).\nQueda de sinal em T1 fora de fase, compatível com esteatose leve (ROI: 374 em fase e 349 fora de fase; queda percentual ~6,7%).\nSem lesões focais hepáticas identificadas.\nVesícula biliar e vias biliares extra-hepáticas\nVesícula biliar sem alterações significativas.\nVias biliares intra e extra-hepáticas sem dilatação.\nPâncreas\nCabeça e corpo com dimensões dentro dos limites da normalidade, com realce pós-contraste aparentemente homogêneo. Ducto pancreático afilado, sem dilatação significativa.\nPequena lesão cística unilocular na transição cabeça/colo/corpo pancreático, medindo cerca de 1,0 cm, com hipersinal em T2, sem componente sólido ou septações identificáveis; comunicação com o ducto pancreático não determinada com segurança.\n\nASSINATURA DIGITAL\nFA0C46ED3258\n\n## LAUDO PRÉVIO [2] — RESSONÂNCIA MAGNÉTICA DE ABDOME TOTAL\n> NOTA: Realizado em 12/12/2025. Fonte: externo\nPré-visualização. Laudo sem valor legal.\n\nNome : PACIENTE_P2\nRG : [REDACTED_RG]\nDN : [REDACTED_DOB]\nMédico : [REDACTED_MEDICO]\nConvênio: [REDACTED_CONVENIO]\nUnidade : [REDACTED_UNIDADE]\n\nId. Paciente : [REDACTED_ID]\nCódigo da OS : [REDACTED_OS]\nCPF : [REDACTED_CPF]\nConselho : [REDACTED_CRM] MG\nAtendimento: [REDACTED_DATETIME]\nQnt de exames: 1\nPágina : 2/5\n\nResponsável Técnico: [REDACTED_RESPONSAVEL]\nLaboratorio registrado no CRM: [REDACTED_REGISTRO]\nEndereço: [REDACTED_ENDERECO]\n\n▶ Estrutura tubuliforme alongada em continuidade com a região de corpo/cauda, em amplo contato com a lâmina anterior da fáscia renal à esquerda, com discreto espessamento fascial adjacente e discretas estriações da gordura peri-esplênica/peripancreática.\n▶ A referida estrutura apresenta porção periférica com hipossinal em T2 e leve hiperintensidade em T1 pré-contraste; conteúdo central com hipersinal em T2 e hipossinal em T1, sem realce pós-contraste evidente e com baixa conspicuidade nas sequências pós-contraste.\n▶ Medidas aproximadas: extensão longitudinal ~6,5-6,8 cm; eixos axiais ~2,3 x 1,7 cm; volume aproximado ~13-14 cm³ (V≈0,52×D1×D2×D3).\n▶ Sem restrição significativa à difusão (difusão facilitada).\nBaço\n▶ Dimensões preservadas (maior eixo ~10,7 cm). Sinal e contornos sem particularidades.\nRins\n▶ Rins tópicos, com dimensões preservadas, sem sinais de dilatação do sistema pielocalicinal.\n▶ Sem evidências de lesões renais complexas à RM.\nAdrenais\n▶ Sem alterações significativas.\nBexiga\n▶ Bexiga parcialmente repleta, sem alterações significativas.\n▶ A avaliação do espessamento parietal vesical pode estar limitada pela repleção parcial.\nÓrgãos pélvicos\n▶ Sinais de histerectomia subtotal, com remanescente do colo uterino sem alterações significativas.\n▶ Avaliação vaginal parcialmente limitada (sem gel vaginal).\n▶ Ovário direito não caracterizado com segurança.\n▶ Em topografia anexial esquerda, estrutura compatível com ovário sem sinais suspeitos, com dimensões estimadas ~2,5 x 1,6 x 1,6 cm.\n▶ Cisto compatível com corpo lúteo no anexo esquerdo, medindo ~1,7 cm (O-RADS 2; 17/12/2025).\nEstômago e duodeno\n▶ Sinais de alterações aderenciais com discreto repuxamento/afilamento na transição corpo-antro do estômago.\nIntestino delgado\n▶ Sem dilatação evidente.\nCólon e apêndice cecal\n▶ Avaliação colônica limitada; sem sinais evidentes de obstrução a montante.\n▶ Sinais de alterações aderenciais até a flexura esplênica, com discreto repuxamento e colapso segmentar, sem obstrução associada.\n▶ Estrutura alongada de aspecto cístico, em continuidade e sem plano de clivagem evidente com a porção fúndica do apêndice\nASSINATURA DIGITAL\nFA0C46ED3258\n\n## LAUDO PRÉVIO [3] — Ressonância Magnética de Abdome Total\n> NOTA: Realizado em 12/12/2025. Fonte: [REDACTED_SOURCE]\nPré-visualização. Laudo sem valor legal.\n\nNome : PACIENTE_P2\nRG : [REDACTED_RG] Código da OS : [REDACTED_OS]\nDN : [REDACTED_DOB] CPF : [REDACTED_CPF]\nMédico : [REDACTED_MEDICO]\nConvênio: [REDACTED_CONVENIO]\nUnidade : [REDACTED_UNIDADE]\nPágina : 3/5\n\nResponsável Técnico: [REDACTED_RESPONSAVEL]\nLaboratorio registrado no CRM: [REDACTED_REGISTRO]\nEndereço: [REDACTED_ENDERECO]\n\nvermiforme, com conteúdo hiperintenso em T2, sem componente sólido identificado.\nMedidas aproximadas: extensão longitudinal ~4,4 cm; eixos axiais ~3,8 x 1,8 cm; espessura parietal até ~2,3 mm.\nAvaliação pós-contraste dessa topografia limitada pela lacuna de cobertura entre bobinas.\nVasos abdominais e pélvicos\nVeia porta pérvia, com calibre preservado (~1,0 cm). Veia mesentérica superior pérvia.\nVeia esplênica com importante afilamento distal, com difícil caracterização, levantando a possibilidade de componente\ntrombótico crônico/oclusivo.\nPresença de circulação colateral venosa calibrosa na topografia perigástrica e em vasos do mesocolo/mesentério à\nesquerda, compatível com hipertensão portal segmentar (sinistral).\nVeia renal esquerda circumaórtica.\nLinfonodos retroperitoneais e pélvicos\nAumento do número de linfonodos retroperitoneais, predominantemente subcentimétricos.\nLinfonodomegalias pélvicas, com destaque para cadeias ilíacas externas e obturatórias: à direita ~2,0 x 1,3 cm; à esquerda\n(obturatória) até ~1,8 x 1,0 cm.\nLinfonodomegalias inguinais superficiais bilaterais, em número aumentado, algumas com discretas alterações\ninflamatórias/perinodais.\nMesentério e peritônio\nAusência de ascite.\nDiscretas estriações da gordura adjacentes à região de cauda pancreática/peri-esplênica (conforme descrito).\nSem implantes peritoneais evidentes.\nParede abdominal e pélvica\nCicatriz cirurgica em parede abdominal inferior, sem sinais de complicações evidentes.\nEstruturas ósseas\nSem lesões ósseas focais suspeitas identificadas no campo avaliado.\nBases pulmonares, pleura basal e diafragma\nSem derrame pleural ou alterações grosseiras nas bases pulmonares no campo avaliado.\n\nCOMPARAÇÃO\n\nExame comparado com tomografia computadorizada de abdome e pelve de 05/11/2025 (imagens disponíveis). Observa-se:\nAchado na cauda pancreática, de aspecto tubuliforme/cístico e caráter provavelmente sequelar, em correlação com o exame\nprévio.\nAchados compatíveis com hipertensão portal segmentar à esquerda/circulação colateral associados a provável\ncomprometimento crônico da veia esplênica, em correlação com o exame prévio.\nEstrutura cística em topografia apendicular, novamente identificada, mantendo hipótese de mucocele (melhor caracterização\n\nASSINATURA DIGITAL\nFA0C46ED3258\n\n# TRANSCRIÇÕES DE DITADO\n- [00:00 - 00:15] Paciente de cinquenta e três anos sexo feminino pedido médico indicativo de [pausa]\n- [00:15 - 00:42] Ressonância magnética prévia do mesmo serviço mostrando trombose esplênica com circulação colateral tá o fígado não tem sinais de cirrose tem uma aparente esteatose tá coloque como outras patologias de depósito aí nos diferenciais né coloque as medidas foram feitas várias medidas aí das veias e dos vasos a gente nota ainda [pausa]\n- [00:43 - 01:21] Eu não consegui visualizar no atual exame aquela lesão cística na cabeça do pâncreas tá a gente nota ainda essa estrutura alongada aí de aspecto tubuliforme hipoecogênica heterogênea sem vascularização estudo doppler situada na região que se estende ali pela mesma região que foi vista na ressonância ali na região da [pausa] da cauda lá em contato com a face renal esquerda tá com as medidas estimadas em pelo menos [pausa]\n- [03:10 - 04:00] É as medidas inclusive estão apresentando as dimensões aí documentadas como cauda pâncreas tá a medida da lesão eh foi visto ainda alguns vasos ali em topografia perigástrica em continuidade aí com alguns vasos do mesentério poderia sugerir a presença de circulação colateral na região tá o as medidas o bastão aí para cálculo do volume tá é difícil a visualização eh da anatomia e importante falar que ainda continua em continuidade com os vasos ali tá essa lesão então não dá para distinguir se daqui pode ser uma sequela de alguma alteração de como uma coleção de um do passado alguma coleção que ficou de aspecto sequelar fibrosou tudo ou se isso daí pode ser uma sequela de uma trombose também prévia tá já que a paciente refere-se assintomática tudo mas é algo que precisa ser acompanhado mas não vejo outras alterações significativas\n- [04:07 - 04:41] Só aí tem o índice hepatorrenal também por favor coloque ele tá e o significado assim como se baseie nas referências aí anexos tá caso seja necessário pesquise na literatura somente a respeito desses artigos para elaboração do laudo e suas especificidades"
}
